{
  "$schema": "./schemas/app-config.schema.json",
  "name": "Gesture Presentation",
  "nameJa": "ジェスチャー・プレゼンテーション",
  "slug": "gesture-presentation",
  "version": "1.3.2",
  "description": "Present PDFs and images with local hand gestures, presentation tools, and two-QR serverless Air Remote pairing with adaptive split answer QRs.",
  "descriptionJa": "PDFや画像を、端末内の手ジェスチャー認識・プレゼンツール・2回QR・回答QR自動分割の完全ローカルAir Remoteで操作できるプレゼンテーションビューアーです。",
  "defaultLanguage": "auto",
  "repository": {
    "owner": "ttomohisa",
    "name": "htmlapps-gesture-presentation"
  },
  "build": {
    "output": "dist/index.html",
    "blockRuntimeNetwork": true,
    "selfExtract": {
      "enabled": true,
      "output": "dist/index.self-extract.html"
    },
    "sizeBudget": {
      "readableWarningMb": 35,
      "selfExtractWarningMb": 18
    }
  }
}
